{
  "$schema": "https://json-schema.org/draft/2020-12/schema",
  "$id": "https://schematics.local/schema/graph.schema.json",
  "title": "Schematic graph",
  "description": "In-memory representation of a transcribed schematic. Source of truth on disk is the .kicad_sch file; this schema describes the intermediate graph the pipeline operates on.",
  "type": "object",
  "required": ["board", "sheets", "components", "nets"],
  "additionalProperties": false,
  "properties": {
    "board": {
      "type": "object",
      "required": ["id", "drawing_number"],
      "properties": {
        "id": { "type": "string" },
        "drawing_number": { "type": "string" },
        "title": { "type": "string" },
        "manufacturer": { "type": "string" },
        "year": { "type": "integer" }
      }
    },
    "sheets": {
      "type": "array",
      "items": {
        "type": "object",
        "required": ["index", "title"],
        "properties": {
          "index": { "type": "integer", "minimum": 1 },
          "title": { "type": "string" },
          "scan_path": { "type": "string", "description": "relative path to the source PNG" },
          "scan_pixel_size": {
            "type": "array",
            "items": { "type": "integer" },
            "minItems": 2,
            "maxItems": 2,
            "description": "[width, height] of the source image"
          },
          "junctions": {
            "type": "array",
            "description": "Connection-dot points on this sheet, in source-image pixels. KiCad needs an explicit (junction (at x y)) at every spot where two wires cross AND connect — without one, KiCad treats the crossing as independent. Recognised by the tracer (LLM vision) at the same time as the wire paths. Each junction is rendering-only on our side because the graph already knows connectivity via endpoints; on the KiCad side it controls whether the rendered .kicad_sch shows the dot.",
            "items": {
              "type": "array",
              "items": { "type": "number" },
              "minItems": 2,
              "maxItems": 2
            }
          }
        }
      }
    },
    "components": {
      "type": "array",
      "items": {
        "type": "object",
        "required": ["refdes", "part", "sheet", "bbox"],
        "properties": {
          "refdes": {
            "type": "string",
            "description": "Manufacturer's reference designator preserved as written, e.g. U14C"
          },
          "part": {
            "type": "string",
            "description": "Key into librarian/chips.json, e.g. 74LS245"
          },
          "sheet": { "type": "integer" },
          "bbox": {
            "type": "array",
            "items": { "type": "number" },
            "minItems": 4,
            "maxItems": 4,
            "description": "[x1,y1,x2,y2] in source-image pixels. CLICK-TARGET extent: includes the chip body PLUS the pin tick marks and small label text, so the explorer's hit-test catches near-edge clicks. The auto-fill DIP layout places pins on this bbox's edges. NOT the drawn chip outline — see body_bbox for that."
          },
          "body_bbox": {
            "type": "array",
            "items": { "type": "number" },
            "minItems": 4,
            "maxItems": 4,
            "description": "[x1,y1,x2,y2] in source-image pixels. TIGHT rectangle around the chip's drawn outline only (no pin ticks, no label text). Used by the KiCad exporter to size the rendered symbol body so it matches the original drawing instead of the looser click-target bbox. Optional — falls back to `bbox` when absent. Captured by the identifier after placing `bbox`, or by `cartographer snap-bbox` when it produces a chip-sized result."
          },
          "verified": {
            "type": "boolean",
            "description": "Human has visually confirmed this component (refdes, part, bbox approximately right). AI-added components default to absent/false; humans toggle via the explorer or graph_cli verify-component."
          },
          "verified_at": {
            "type": "string",
            "format": "date-time",
            "description": "ISO 8601 timestamp the verification was set (optional)."
          },
          "verified_by": {
            "type": "string",
            "description": "Free-form attribution, e.g. 'alan@workbench'. Optional."
          },
          "value": {
            "type": "string",
            "description": "Instance-level value for discrete parts: resistance (1k, 2k2, 4M7), capacitance (22p, 100n, 1u), frequency (7.3728MHz), etc. The KiCad export uses this as the symbol's Value property (and the BOM aggregates by it). Ignored for ICs, which use the part name as Value."
          },
          "pin_positions": {
            "type": "object",
            "description": "Per-pin coordinates [x,y] in source-image pixels. Keys are pin numbers as strings. Auto-seeded by the viewer using a default DIP layout; user-refined by dragging.",
            "patternProperties": {
              "^[A-Za-z0-9_/]+$": {
                "type": "array",
                "items": { "type": "number" },
                "minItems": 2,
                "maxItems": 2
              }
            },
            "additionalProperties": false
          },
          "evidence": { "$ref": "#/$defs/evidence" }
        }
      }
    },
    "nets": {
      "type": "array",
      "items": {
        "type": "object",
        "required": ["name", "endpoints"],
        "properties": {
          "name": {
            "type": "string",
            "description": "Mnemonic name, e.g. A0, ~CSC, GND. Tilde prefix denotes active-low."
          },
          "kind": {
            "type": "string",
            "enum": ["signal", "power", "ground", "clock", "bus_member"],
            "default": "signal"
          },
          "endpoints": {
            "type": "array",
            "minItems": 1,
            "items": {
              "type": "object",
              "required": ["refdes", "pin", "edge_type"],
              "properties": {
                "refdes": { "type": "string" },
                "pin": {
                  "oneOf": [{ "type": "integer" }, { "type": "string" }],
                  "description": "Pin number or name as defined in chips.json"
                },
                "sheet": { "type": "integer" },
                "edge_type": {
                  "type": "string",
                  "enum": ["wire", "label", "sheet_zone", "off_page", "bus", "implicit_power"],
                  "description": "How the connection is expressed on paper. Mixing types in one net is an error."
                },
                "sheet_zone_ref": {
                  "type": "string",
                  "description": "For edge_type=sheet_zone: original notation as drawn, e.g. 4C6"
                },
                "evidence": { "$ref": "#/$defs/evidence" }
              }
            }
          },
          "path": {
            "type": "array",
            "description": "Routed polyline for this net in source-image pixels. Right-angle segments only (every consecutive pair differs in exactly one of x/y). Provided by the tracer (LLM vision reading the source) so the KiCad export can emit (wire ...) segments matching the original artwork instead of straight pin-to-pin diagonals. When absent the exporter falls back to a one-corner Manhattan route between endpoints. Rendering only — connectivity is canonical via `endpoints`.",
            "items": {
              "type": "array",
              "items": { "type": "number" },
              "minItems": 2,
              "maxItems": 2
            }
          },
          "paths_by_sheet": {
            "type": "object",
            "description": "Optional sheet-scoped routed polylines for cross-sheet named nets. Keys are sheet indexes as strings; values have the same point format as `path`. Used when a named net needs different visual bus/label artwork on multiple sheets.",
            "patternProperties": {
              "^[0-9]+$": {
                "type": "array",
                "items": {
                  "type": "array",
                  "items": { "type": "number" },
                  "minItems": 2,
                  "maxItems": 2
                }
              }
            },
            "additionalProperties": false
          },
          "path_source": {
            "type": "string",
            "enum": ["ai", "human", "tracer"],
            "description": "Provenance of the path. `human` overrides `ai` overrides `tracer`."
          }
        }
      }
    }
  },
  "$defs": {
    "evidence": {
      "type": "object",
      "description": "Provenance of an assertion in the graph.",
      "properties": {
        "source": {
          "type": "string",
          "enum": ["ai", "human", "datasheet", "probe"]
        },
        "confidence": { "type": "number", "minimum": 0, "maximum": 1 },
        "probe_log_ref": {
          "type": "string",
          "description": "Anchor in discrepancies.md if verified or contradicted by a board probe"
        },
        "note": { "type": "string" }
      }
    }
  }
}
