{
  "board": {
    "id": "dorado_base",
    "drawing_number": "Dorado-Baseboard",
    "title": "Xerox Dorado Base Board",
    "manufacturer": "Xerox PARC",
    "year": 1979
  },
  "sheets": [
    {
      "index": 1,
      "title": "Alto-to-Baseboard cabling (wire list)",
      "scan_path": "../../doradoschematics/scans/pages/baseboard_p01.png",
      "scan_pixel_size": [
        2563,
        3306
      ]
    },
    {
      "index": 2,
      "title": "page 2",
      "scan_path": "../../doradoschematics/scans/pages/baseboard_p02.png",
      "scan_pixel_size": [
        2576,
        3316
      ]
    },
    {
      "index": 3,
      "title": "page 3",
      "scan_path": "../../doradoschematics/scans/pages/baseboard_p03.png",
      "scan_pixel_size": [
        2556,
        3301
      ]
    },
    {
      "index": 4,
      "title": "page 4",
      "scan_path": "../../doradoschematics/scans/pages/baseboard_p04.png",
      "scan_pixel_size": [
        2556,
        3301
      ]
    },
    {
      "index": 5,
      "title": "Microcomputer and ROM",
      "scan_path": "../../doradoschematics/scans/pages/baseboard_p05.png",
      "scan_pixel_size": [
        2550,
        3296
      ]
    },
    {
      "index": 6,
      "title": "page 6",
      "scan_path": "../../doradoschematics/scans/pages/baseboard_p06.png",
      "scan_pixel_size": [
        2563,
        3306
      ]
    },
    {
      "index": 7,
      "title": "page 7",
      "scan_path": "../../doradoschematics/scans/pages/baseboard_p07.png",
      "scan_pixel_size": [
        2556,
        3301
      ]
    },
    {
      "index": 8,
      "title": "page 8",
      "scan_path": "../../doradoschematics/scans/pages/baseboard_p08.png",
      "scan_pixel_size": [
        2563,
        3306
      ]
    },
    {
      "index": 9,
      "title": "page 9",
      "scan_path": "../../doradoschematics/scans/pages/baseboard_p09.png",
      "scan_pixel_size": [
        2563,
        3306
      ]
    },
    {
      "index": 10,
      "title": "page 10",
      "scan_path": "../../doradoschematics/scans/pages/baseboard_p10.png",
      "scan_pixel_size": [
        2563,
        3306
      ]
    },
    {
      "index": 11,
      "title": "page 11",
      "scan_path": "../../doradoschematics/scans/pages/baseboard_p11.png",
      "scan_pixel_size": [
        2569,
        3311
      ]
    },
    {
      "index": 12,
      "title": "page 12",
      "scan_path": "../../doradoschematics/scans/pages/baseboard_p12.png",
      "scan_pixel_size": [
        2563,
        3306
      ]
    },
    {
      "index": 13,
      "title": "page 13",
      "scan_path": "../../doradoschematics/scans/pages/baseboard_p13.png",
      "scan_pixel_size": [
        2563,
        3306
      ]
    },
    {
      "index": 14,
      "title": "page 14",
      "scan_path": "../../doradoschematics/scans/pages/baseboard_p14.png",
      "scan_pixel_size": [
        2563,
        3306
      ]
    },
    {
      "index": 15,
      "title": "page 15",
      "scan_path": "../../doradoschematics/scans/pages/baseboard_p15.png",
      "scan_pixel_size": [
        2569,
        3311
      ]
    },
    {
      "index": 16,
      "title": "page 16",
      "scan_path": "../../doradoschematics/scans/pages/baseboard_p16.png",
      "scan_pixel_size": [
        2563,
        3306
      ]
    },
    {
      "index": 17,
      "title": "page 17",
      "scan_path": "../../doradoschematics/scans/pages/baseboard_p17.png",
      "scan_pixel_size": [
        2576,
        3316
      ]
    },
    {
      "index": 18,
      "title": "page 18",
      "scan_path": "../../doradoschematics/scans/pages/baseboard_p18.png",
      "scan_pixel_size": [
        2563,
        3306
      ]
    },
    {
      "index": 19,
      "title": "page 19",
      "scan_path": "../../doradoschematics/scans/pages/baseboard_p19.png",
      "scan_pixel_size": [
        2569,
        3311
      ]
    },
    {
      "index": 20,
      "title": "page 20",
      "scan_path": "../../doradoschematics/scans/pages/baseboard_p20.png",
      "scan_pixel_size": [
        2563,
        3306
      ]
    },
    {
      "index": 21,
      "title": "page 21",
      "scan_path": "../../doradoschematics/scans/pages/baseboard_p21.png",
      "scan_pixel_size": [
        2569,
        3311
      ]
    },
    {
      "index": 22,
      "title": "page 22",
      "scan_path": "../../doradoschematics/scans/pages/baseboard_p22.png",
      "scan_pixel_size": [
        2556,
        3301
      ]
    },
    {
      "index": 23,
      "title": "page 23",
      "scan_path": "../../doradoschematics/scans/pages/baseboard_p23.png",
      "scan_pixel_size": [
        2569,
        3311
      ]
    },
    {
      "index": 24,
      "title": "page 24",
      "scan_path": "../../doradoschematics/scans/pages/baseboard_p24.png",
      "scan_pixel_size": [
        2556,
        3301
      ]
    },
    {
      "index": 25,
      "title": "page 25",
      "scan_path": "../../doradoschematics/scans/pages/baseboard_p25.png",
      "scan_pixel_size": [
        2550,
        3296
      ]
    },
    {
      "index": 26,
      "title": "page 26",
      "scan_path": "../../doradoschematics/scans/pages/baseboard_p26.png",
      "scan_pixel_size": [
        2556,
        3301
      ]
    },
    {
      "index": 27,
      "title": "page 27",
      "scan_path": "../../doradoschematics/scans/pages/baseboard_p27.png",
      "scan_pixel_size": [
        2550,
        3296
      ]
    }
  ],
  "components": [
    {
      "refdes": "d08",
      "part": "MC12061",
      "sheet": 5,
      "bbox": [
        510,
        525,
        870,
        1080
      ],
      "evidence": {
        "source": "ai",
        "confidence": 0.7,
        "note": "10 MHz oscillator, top-left of page (tile r0c0)"
      },
      "pin_positions": {
        "1": [
          570,
          525
        ],
        "2": [
          870,
          564.6428571428571
        ],
        "3": [
          870,
          643.9285714285714
        ],
        "4": [
          540,
          1080
        ],
        "5": [
          870,
          723.2142857142858
        ],
        "6": [
          870,
          802.5
        ],
        "7": [
          600,
          1080
        ],
        "8": [
          660,
          1080
        ],
        "9": [
          720,
          1080
        ],
        "10": [
          870,
          881.7857142857143
        ],
        "11": [
          690,
          525
        ],
        "12": [
          870,
          961.0714285714286
        ],
        "13": [
          870,
          1040.357142857143
        ],
        "14": [
          780,
          1080
        ],
        "15": [
          840,
          1080
        ],
        "16": [
          810,
          525
        ]
      }
    },
    {
      "refdes": "g08",
      "part": "74LS74",
      "sheet": 5,
      "bbox": [
        1480,
        230,
        1645,
        450
      ],
      "evidence": {
        "source": "ai",
        "confidence": 0.7,
        "note": "D flip-flop, section g08a drawn here (tile r0c1)"
      },
      "pin_positions": {
        "1": [
          1489.1666666666667,
          450
        ],
        "2": [
          1507.5,
          450
        ],
        "3": [
          1525.8333333333333,
          450
        ],
        "4": [
          1544.1666666666667,
          450
        ],
        "5": [
          1645,
          257.5
        ],
        "6": [
          1645,
          312.5
        ],
        "7": [
          1562.5,
          450
        ],
        "8": [
          1645,
          367.5
        ],
        "9": [
          1645,
          422.5
        ],
        "10": [
          1580.8333333333333,
          450
        ],
        "11": [
          1599.1666666666667,
          450
        ],
        "12": [
          1617.5,
          450
        ],
        "13": [
          1635.8333333333333,
          450
        ],
        "14": [
          1562.5,
          230
        ]
      }
    },
    {
      "refdes": "c08",
      "part": "74LS04",
      "sheet": 5,
      "bbox": [
        1070,
        880,
        1215,
        1005
      ],
      "evidence": {
        "source": "ai",
        "confidence": 0.5,
        "note": "LS04 inverter, section c08a; b/c on row 2"
      },
      "pin_positions": {
        "1": [
          1080.357142857143,
          1005
        ],
        "2": [
          1215,
          890.4166666666666
        ],
        "3": [
          1101.0714285714287,
          1005
        ],
        "4": [
          1215,
          911.25
        ],
        "5": [
          1121.7857142857142,
          1005
        ],
        "6": [
          1215,
          932.0833333333334
        ],
        "7": [
          1142.5,
          1005
        ],
        "8": [
          1215,
          952.9166666666666
        ],
        "9": [
          1163.2142857142858,
          1005
        ],
        "10": [
          1215,
          973.75
        ],
        "11": [
          1183.9285714285713,
          1005
        ],
        "12": [
          1215,
          994.5833333333334
        ],
        "13": [
          1204.642857142857,
          1005
        ],
        "14": [
          1142.5,
          880
        ]
      }
    },
    {
      "refdes": "h61",
      "part": "2716",
      "sheet": 5,
      "bbox": [
        2000,
        505,
        2245,
        970
      ],
      "evidence": {
        "source": "ai",
        "confidence": 0.8,
        "note": "EPROM (top of stack of 4)"
      },
      "pin_positions": {
        "1": [
          2000,
          653
        ],
        "2": [
          2000,
          695
        ],
        "3": [
          2000,
          737
        ],
        "4": [
          2000,
          780
        ],
        "5": [
          2000,
          822
        ],
        "6": [
          2000,
          864
        ],
        "7": [
          2000,
          906